[
  {
    "id": "collection-fanout-professional-guidance",
    "kind": "collection",
    "title": "Professional guidance — source expansion",
    "summary": "6 original-source references for professional guidance, with bounded editorial summaries, access caveats and workflow links.",
    "topics": [
      "Audit and assurance",
      "Source discovery"
    ],
    "industries": [],
    "jurisdiction": null,
    "source_type": null,
    "publisher": "Accounting Agents contributors",
    "source_url": null,
    "source_ids": [
      "src_fanout_d7ead1a32cc1",
      "src_fanout_43a68088fe70",
      "src_fanout_74356df8f3f7",
      "src_fanout_e9c645ea811e",
      "src_fanout_25d7b7df11e3",
      "src_fanout_63692de04ab0"
    ],
    "related_ids": [
      "wf-audit-evidence-evaluation",
      "wf-audit-management-review"
    ],
    "review_status": "editorially-reviewed",
    "reviewed_at": "2026-10-02",
    "provenance": {
      "added_on": "2026-10-02",
      "reviewer": "Codex AI-assisted source curation",
      "review_scope": "Organization of the newly source-checked references; no professional or industry-sufficiency review.",
      "note": "Inventory breadth is not evidence of complete coverage. See the per-source limitations and research ledger."
    },
    "rights": {
      "metadata": "CC0-1.0",
      "content": "CC-BY-4.0",
      "external_content": "Not included; publisher terms apply",
      "full_text_stored": false,
      "source_status": "unknown",
      "source_license": null,
      "source_license_url": null,
      "source_permission_scope": null
    },
    "data": {
      "source_count": 6,
      "limitations": [
        "Source scope and applicability vary; no industry is upgraded to sufficient coverage."
      ]
    }
  },
  {
    "id": "collection-fanout-accounting-mcp",
    "kind": "collection",
    "title": "Accounting MCP — source expansion",
    "summary": "5 original-source references for accounting mcp, with bounded editorial summaries, access caveats and workflow links.",
    "topics": [
      "Agent interoperability",
      "Source discovery"
    ],
    "industries": [],
    "jurisdiction": null,
    "source_type": null,
    "publisher": "Accounting Agents contributors",
    "source_url": null,
    "source_ids": [
      "src_fanout_8ea03884ae19",
      "src_fanout_409b376675ff",
      "src_fanout_5207b2ecbe7b",
      "src_fanout_148143461efa",
      "src_fanout_ac8ea957fa62"
    ],
    "related_ids": [
      "wf-r2r-journal-entry",
      "wf-r2r-balance-reconciliations"
    ],
    "review_status": "editorially-reviewed",
    "reviewed_at": "2026-10-02",
    "provenance": {
      "added_on": "2026-10-02",
      "reviewer": "Codex AI-assisted source curation",
      "review_scope": "Organization of the newly source-checked references; no professional or industry-sufficiency review.",
      "note": "Inventory breadth is not evidence of complete coverage. See the per-source limitations and research ledger."
    },
    "rights": {
      "metadata": "CC0-1.0",
      "content": "CC-BY-4.0",
      "external_content": "Not included; publisher terms apply",
      "full_text_stored": false,
      "source_status": "unknown",
      "source_license": null,
      "source_license_url": null,
      "source_permission_scope": null
    },
    "data": {
      "source_count": 5,
      "limitations": [
        "Source scope and applicability vary; no industry is upgraded to sufficient coverage."
      ]
    }
  },
  {
    "id": "collection-fanout-research-and-evaluation",
    "kind": "collection",
    "title": "Research and evaluation — source expansion",
    "summary": "23 original-source references for research and evaluation, with bounded editorial summaries, access caveats and workflow links.",
    "topics": [
      "Evaluation and evidence",
      "Source discovery"
    ],
    "industries": [],
    "jurisdiction": null,
    "source_type": null,
    "publisher": "Accounting Agents contributors",
    "source_url": null,
    "source_ids": [
      "src_fanout_9bd56533e385",
      "src_fanout_b2017f664675",
      "src_fanout_a30eb12b94ec",
      "src_fanout_19e06b2ffef6",
      "src_fanout_5100863be7f9",
      "src_fanout_270fe0c57295",
      "src_fanout_9d04644ab214",
      "src_fanout_85a6623d864b",
      "src_fanout_8e49f3f5077d",
      "src_fanout_a80af492d026",
      "src_fanout_0b87ac68a91e",
      "src_fanout_3a9d87b285e3",
      "src_fanout_dcaf035da14f",
      "src_fanout_b66a4131a441",
      "src_fanout_c9985cdbc7f5",
      "src_fanout_55da69215b52",
      "src_fanout_3c97d73eac3f",
      "src_fanout_a42e721931ec",
      "src_fanout_18cc62184ece",
      "src_fanout_66aa5a17a7c9",
      "src_fanout_b0cdf21168f4",
      "src_fanout_1b491c54b800",
      "src_fanout_afc1dfc6d9a4"
    ],
    "related_ids": [
      "wf-audit-evidence-evaluation"
    ],
    "review_status": "editorially-reviewed",
    "reviewed_at": "2026-10-02",
    "provenance": {
      "added_on": "2026-10-02",
      "reviewer": "Codex AI-assisted source curation",
      "review_scope": "Organization of the newly source-checked references; no professional or industry-sufficiency review.",
      "note": "Inventory breadth is not evidence of complete coverage. See the per-source limitations and research ledger."
    },
    "rights": {
      "metadata": "CC0-1.0",
      "content": "CC-BY-4.0",
      "external_content": "Not included; publisher terms apply",
      "full_text_stored": false,
      "source_status": "unknown",
      "source_license": null,
      "source_license_url": null,
      "source_permission_scope": null
    },
    "data": {
      "source_count": 23,
      "limitations": [
        "Source scope and applicability vary; no industry is upgraded to sufficient coverage."
      ]
    }
  },
  {
    "id": "collection-fanout-quickbooks-interfaces",
    "kind": "collection",
    "title": "QuickBooks interfaces — source expansion",
    "summary": "7 original-source references for quickbooks interfaces, with bounded editorial summaries, access caveats and workflow links.",
    "topics": [
      "Systems, integrations and accounting migrations",
      "Source discovery"
    ],
    "industries": [],
    "jurisdiction": null,
    "source_type": null,
    "publisher": "Accounting Agents contributors",
    "source_url": null,
    "source_ids": [
      "src_fanout_6b4815c823ed",
      "src_fanout_6a4751b7b880",
      "src_fanout_f3edd8f77c09",
      "src_fanout_d7cf3a1d8267",
      "src_fanout_97561ad5cfbc",
      "src_fanout_6b22f68a4272",
      "src_fanout_e9c61176285f"
    ],
    "related_ids": [
      "wf-r2r-journal-entry",
      "wf-r2r-balance-reconciliations"
    ],
    "review_status": "editorially-reviewed",
    "reviewed_at": "2026-10-02",
    "provenance": {
      "added_on": "2026-10-02",
      "reviewer": "Codex AI-assisted source curation",
      "review_scope": "Organization of the newly source-checked references; no professional or industry-sufficiency review.",
      "note": "Inventory breadth is not evidence of complete coverage. See the per-source limitations and research ledger."
    },
    "rights": {
      "metadata": "CC0-1.0",
      "content": "CC-BY-4.0",
      "external_content": "Not included; publisher terms apply",
      "full_text_stored": false,
      "source_status": "unknown",
      "source_license": null,
      "source_license_url": null,
      "source_permission_scope": null
    },
    "data": {
      "source_count": 7,
      "limitations": [
        "Source scope and applicability vary; no industry is upgraded to sufficient coverage."
      ]
    }
  },
  {
    "id": "collection-fanout-xero-interfaces",
    "kind": "collection",
    "title": "Xero interfaces — source expansion",
    "summary": "6 original-source references for xero interfaces, with bounded editorial summaries, access caveats and workflow links.",
    "topics": [
      "Systems, integrations and accounting migrations",
      "Source discovery"
    ],
    "industries": [],
    "jurisdiction": null,
    "source_type": null,
    "publisher": "Accounting Agents contributors",
    "source_url": null,
    "source_ids": [
      "src_fanout_c541f85af812",
      "src_fanout_516e294fafef",
      "src_fanout_bc6ef63f0892",
      "src_fanout_e47c8b630550",
      "src_fanout_ea75c33a174e",
      "src_fanout_95511c912b76"
    ],
    "related_ids": [
      "wf-r2r-journal-entry",
      "wf-r2r-balance-reconciliations"
    ],
    "review_status": "editorially-reviewed",
    "reviewed_at": "2026-10-02",
    "provenance": {
      "added_on": "2026-10-02",
      "reviewer": "Codex AI-assisted source curation",
      "review_scope": "Organization of the newly source-checked references; no professional or industry-sufficiency review.",
      "note": "Inventory breadth is not evidence of complete coverage. See the per-source limitations and research ledger."
    },
    "rights": {
      "metadata": "CC0-1.0",
      "content": "CC-BY-4.0",
      "external_content": "Not included; publisher terms apply",
      "full_text_stored": false,
      "source_status": "unknown",
      "source_license": null,
      "source_license_url": null,
      "source_permission_scope": null
    },
    "data": {
      "source_count": 6,
      "limitations": [
        "Source scope and applicability vary; no industry is upgraded to sufficient coverage."
      ]
    }
  },
  {
    "id": "collection-fanout-sage-intacct-interfaces",
    "kind": "collection",
    "title": "Sage Intacct interfaces — source expansion",
    "summary": "14 original-source references for sage intacct interfaces, with bounded editorial summaries, access caveats and workflow links.",
    "topics": [
      "Systems, integrations and accounting migrations",
      "Source discovery"
    ],
    "industries": [],
    "jurisdiction": null,
    "source_type": null,
    "publisher": "Accounting Agents contributors",
    "source_url": null,
    "source_ids": [
      "src_fanout_9488a2f9cd5c",